{
  "schemaVersion": 1,
  "protocol": "afterburner.ui",
  "revision": 1,
  "sessionId": "session-001",
  "extensionId": "black-box",
  "messageId": "env-001",
  "id": "env-001",
  "epoch": 1,
  "generation": 3,
  "sequence": 42,
  "kind": "component.snapshot",
  "source": {
    "kind": "extension",
    "id": "black-box"
  },
  "target": {
    "kind": "renderer",
    "id": "terminal-renderer"
  },
  "timestamp": "2026-09-04T20:21:10Z",
  "correlationId": "corr-001",
  "compatibility": ["afterburner.ui.r1"],
  "contentType": "application/json",
  "auth": {
    "algorithm": "HMAC-SHA256",
    "keyId": "afterburner.ui:black-box:1",
    "epoch": 1,
    "nonce": "bm9uY2UtZm9yLWZpeHR1cmU",
    "timestamp": "2026-09-04T20:21:10Z",
    "signature": "mC8kY4Pg_0uqsRXhtxv1Qw1L6hCN7klMD17l65zvr0M"
  },
  "payload": {
    "root": {
      "id": "app-root",
      "kind": "application",
      "props": {
        "title": "Afterburner"
      }
    },
    "revision": 7,
    "surfaceId": "surface-terminal-main"
  }
}
