{
  "schemaVersion": 1,
  "protocol": "afterburner.ui",
  "revision": 1,
  "sessionId": "session-001",
  "extensionId": "fixture-extension",
  "messageId": "env-patch-001",
  "id": "env-patch-001",
  "epoch": 1,
  "generation": 1,
  "sequence": 2,
  "timestamp": "2026-09-04T20:21:10.000Z",
  "kind": "component.patch",
  "source": {
    "kind": "sdk",
    "id": "fixture-extension"
  },
  "target": {
    "kind": "renderer",
    "id": "fixture-renderer"
  },
  "compatibility": [
    "afterburner.ui.r1"
  ],
  "contentType": "application/json",
  "payload": {
    "schemaVersion": 1,
    "protocol": "afterburner.ui",
    "revision": 1,
    "surfaceId": "surface-main",
    "baseRevision": 7,
    "nextRevision": 8,
    "operations": [
      {
        "op": "replace",
        "path": "/root/children/0/props/value",
        "value": "done",
        "reason": "fixture update"
      }
    ]
  }
}
