{
  "schemaVersion": 1,
  "protocol": "afterburner.ui",
  "revision": 1,
  "sessionId": "session-001",
  "extensionId": "fixture-extension",
  "messageId": "env-snapshot-001",
  "id": "env-snapshot-001",
  "epoch": 1,
  "generation": 1,
  "sequence": 1,
  "timestamp": "2026-09-04T20:21:10.000Z",
  "kind": "component.snapshot",
  "source": {
    "kind": "sdk",
    "id": "fixture-extension"
  },
  "target": {
    "kind": "renderer",
    "id": "fixture-renderer"
  },
  "compatibility": [
    "afterburner.ui.r1"
  ],
  "contentType": "application/json",
  "payload": {
    "root": {
      "id": "app-root",
      "kind": "application",
      "props": {
        "title": "Protocol"
      },
      "children": [
        {
          "id": "status-text",
          "kind": "text",
          "props": {
            "value": "ready"
          }
        }
      ]
    },
    "revision": 7,
    "surfaceId": "surface-main",
    "themeId": "afterburner.dark",
    "locale": "en-US",
    "capabilities": [
      "ui.render.components"
    ]
  }
}
